PRODUCTDESCRIPTION,PRODUCTNAME,ID,PRICE,CATEGORY,STOCKQUANTITY,INVENTORYVALUE,PHOTOLINK,INGREDIENTS
Mayo Spread,Lady's Choice Real Mayonnaise 80ml,000-280,32,Spreads,8,₱256.00,https://www.wowtiongsan.com/shop/1019-large_default/1030.jpg,"SOYBEAN OIL, WATER, EGGS, SUGAR VINEGAR, IODIZED SALT, STABILIZER (PROPYLENE GLYCOL ALGINATE),SPICES,PRESERVATIVE (POTASSIUM SORBATE NATURE IDENTICAL FLAVOR, COLOR (BETA CAROTENE CALCIUM DISODIUM EDTA ADDED TO PROTECT FLAVOR CONTAINS: EGGS, MILK PRODUCTS Substances or products causing allergies or intolerances: Eggs, Soybeans"
Mayo Spread,Lady's Choice Sandwich Spread 80ml,000-281,34,Spreads,3,₱102.00,https://www.wowtiongsan.com/shop/585-large_default/550.jpg,"Water, Soybean Oil, Pickle Relish (Cucumber, Sugar, Vinegar, Water, Salt, Spice), Sugar, Vinegar, Corn Starch, Pasteurised Egg, Modified Corn Starch, Iodised Salt (Salt, Iodine), Spice (Contains Mustard, Celery, Milk), Thickener (E415), Preservatives (E200, E202), Acidity Regulator (E338), Sweeteners (E951, E950), Citric Acid, Colour (Beta Carotene), Stabiliser (E385)."
Mayo Spread,Lady's Choice Tuna Spread 80ml,000-282,34,Spreads,4,₱136.00,https://www.wowtiongsan.com/shop/1215-large_default/1265.jpg,"Ingredients: Soybean Oil, Water, Sugar, Pasteurised Tuna (Fish) (15%), Vinegar, Pasteurised Egg, Pickle Relish (Cucumber, Sugar, Vinegar, Water, Salt, Spice), Iodised Salt (Salt, Iodine), Corn Starch, Modified Corn Starch, Pimiento, Flavour Enhancers (E621, E631), Flavouring, Preservatives (E202, E211), Carrot, Thickeners (Xanthan Gum, E405), Spice (Contains Mustard, Celery, Milk), Sweetener (E951), Acidity Regulator (E330), Colours (E110, Beta Carotene), Stabiliser (E385). Contains:  eggs, celery, mustard, milk products"
Canned Goods,Ligo Sardines Green 425g,000-283,21,Food,3,₱63.00,https://ph-test-11.slatic.net/p/bc1211fe7162e52db28f350940b68a9f.jpg,"Sardines, Tomato Sauce Which is Made from Tomato Paste and Water, Modified Cornstarch, Iodized Salt (Salt + Potassium Iodate, Sugar, Onion Powder, Garlic Powder"
Canned Goods,Ligo Sardines Green Easy Open 155g,000-284,21,Food,12,₱252.00,https://cdn.shopify.com/s/files/1/0260/6877/9066/products/487345_3fbe6bab-758d-4b55-83c6-67ecdeceeaab_700x700.jpg?v=1627719530,"Sardines, Tomato Sauce Which is Made from Tomato Paste and Water, Modified Cornstarch, Iodized Salt (Salt + Potassium Iodate, Sugar, Onion Powder, Garlic Powder"
Canned Goods,Ligo Sardines Red 425g,000-285,21,Food,3,₱63.00,https://ph-test-11.slatic.net/p/mdc/e55ad29bf955be2cc2b00ad737c01fee.jpg,"Sardines, Tomato Sauce Which is Made from Tomato Paste and Water, Modified Cornstarch, Iodized Salt (Salt + Potassium Iodate, Sugar, Onion Powder, Garlic Powder, Chili."
Canned Goods,Ligo Sardines Red Easy Open 155g,000-286,21,Food,12,₱252.00,https://cdn.shopify.com/s/files/1/0441/4776/9509/products/Ligo_Sardines_T_S_W_Chili_Red_Easy_Open_155g_300x300.jpg?v=1603363293,"Sardines, Tomato Sauce Which is Made from Tomato Paste and Water, Modified Cornstarch, Iodized Salt (Salt + Potassium Iodate, Sugar, Onion Powder, Garlic Powder, Chili."
Tea Bag,Lipton Tea Bags Yellow Label 2g,000-287,4,Beverages,25,₱100.00,https://shop.themetrostores.ph/marketmarket-supermarket/wp-content/uploads/2021/03/SM8433428-1.jpg,Black Tea.
Food Mixes,Lorins Patis Plastic 350ml,000-288,22,Condiments,15,₱330.00,https://i0.wp.com/tindahannionang.com/wp-content/uploads/2020/05/lorins-patis.jpg?fit=800%2C800&ssl=1,"Water, Fermented Fish Extract, Iodized Salt, Sodium Benzoate, Caramel, Potassium Sorbate, Monosodium Glutamate, and Disodium Inosinate."
Food Mixes,Lorins Patis Pouch 150ml,000-289,12,Condiments,6,₱72.00,https://fishersupermarket.ph/wp-content/uploads/2020/10/4804888999342.jpg,
Cup Noodles,Lucky Me! Gocup Mini Jjampong 40g,000-290,22,Instant Noodles,4,₱88.00,https://imartgrocersph.com/wp-content/uploads/2020/09/Lucky-Me-Go-Cup-Jjamppong-40g.png,"WHEAT Flour, Palm Oil, Food Starch-modified (Tapioca and/or Potato), Salt, Stabilizer (Guar Gum, Sodium Polyphosphate, Sodium Carbonate, Potassium Carbonate), color Tartrazine E102: May have a negative effect on children's behavior and concentration, Green Tea Extract.
Seasoning and Garish: Artificial Seafood Flavor, Salt Flavor Enhancers (Monosodium Glutamate E621, Disodium 5 Inosinate, Disodium 5 Guanylate), Vegetable Fat Powder (Palm), Cane Sugar, Spices (Garlic, Black Pepper, Capsicum), Dehydrated Vegetables (Chives, Seaweed, Cabbage, Carrots), Freeze Dried Cuttlefish, Color (Paprika) and Anticaking Agent (Silicon Dioxide)."
Cup Noodles,Lucky Me! Gocup Mini Seafood 40g,000-291,18,Instant Noodles,6,₱108.00,https://fishersupermarket.ph/wp-content/uploads/2020/10/4807770272943.png,-
Cup Noodles,Lucky Me! Gocup Mini Spicy Bulalo 40g,000-292,18,Instant Noodles,6,₱108.00,https://imartgrocersph.com/wp-content/uploads/2020/09/Lucky-Me-Go-Cup-Bulalo-40g.png,"Wheat Flour, Vegetable Oil, Modified Starch, Iodized Salt, Stabilizers, Artificial colour With Tartrazine, Green Tea Extract."
Pouch Noodles,Lucky Me! Instant Noodles Beef 55g,000-293,10,Instant Noodles,72,₱720.00,https://imartgrocersph.com/wp-content/uploads/2020/09/Lucky-Me-Instant-Noodles-Beef-55g.png,"Wheat Flour, Palm Oil, Salt, Acidity Regulator: Potassium and Sodium Carbonates, Emulsifier: Sodium Tripolyphosphate, Stabiliser: Guar Gum, Green Teas Extract"
Pouch Noodles,Lucky Me! Instant Noodles Chicken 55g,000-294,10,Instant Noodles,72,₱720.00,https://imartgrocersph.com/wp-content/uploads/2020/09/Lucky-Me-Instant-Noodles-Chicken-55g.png,"Wheat Flour, Palm Oil, Food Starch Modified (Tapioca and/or Potato), Salt, Stabilizer (Guar Gum), Emulsifier (Sodium Polyphosphate), Acidity Regulator (Sodium Carbonate, Potassium Carbonate), Green Tea Extract. Seasoning and Garnish: Salt, Flavor Enhancers (Monosodium Glutamate, Disodium 5 Inosinate, Disodium 5 Guanylate), Spices (Onion, Garlic, Black Pepper), Texture Wheat Protein, Cornstarch, Cane Sugar, Artificial Chicken Flavors, Hydrolyzed Soy Protein, Dehydrated Vegetables (Chives)."
Pouch Noodles,Lucky Me! Instant Noodles Spicy Beef 50g,000-295,10,Instant Noodles,24,₱240.00,https://www.crempcoop.com/wp-content/uploads/2019/07/12-1.png,"Noodles 88%: Wheat flour, palm oil, salt, acidity regulator E501, E500, emulsifier E452, stabilizer E412, green tea extract.
Flavoring: salt, cane sugar, beef aroma, flavor enhancers E621, E631, E627, freeze-dried spring onions, spices (black pepper, garlic, chili extract 0.1%), corn starch, hydrolyzed SOY-protein, color E150d, anticaking agent E551.

This product may contain traces of crustaceans, egg, fish, milk, celery and molluscs."
Pouch Noodles,Lucky Me! Instant Pancit Canton Chilimansi 60g,000-296,14,Instant Noodles,72,"₱1,008.00",https://store.iloilosupermart.com/wp-content/uploads/2020/05/11.png,"Wheat Flour, Vegetable Oil (Palm Oil, Green Tea Extract), Salt, Stabilizer (Guar Gum), Acidity Regulator (Sodium Carbonate, Potassium Carbonate), Emulsifier (Polyphosphate), Seasoning: Coconut Oil, Soy Sauce (Water, Soybean, Salt, Preservative [Potassium Sorbate], Cane Sugar, Artificial Chicken Flavor, Flavor Enhancers (Monosodium Glutamate, Disodium 5 Inosinate, Disodium 5 Guanylate), Salt, Maltodextrin, Spices (Red Pepper (1.5%) Garlic, Black Pepper), Acid (Citric Acid), Color (Caramel Color, Beta Carotene), Hydrolyzed Soy Protein, Citrus Flavor."
Pouch Noodles,Lucky Me! Instant Pancit Canton Hot Chili 60g,000-297,14,Instant Noodles,72,"₱1,008.00",https://cdn.shopify.com/s/files/1/2713/3026/products/instant-pancit-canton-hot-chilli-flavor-von-lucky-me-60g_600x.jpg?v=1545281034,"WHEAT FLOUR, VEGETABLE OIL (PALM OIL, GREEN TEA EXTRACT), SALT, STABILIZER (GUAR GUM), CARBONATES (SODIUM AND POTASSIUM), CALCIUM TRIPOLYPHOSPHATE. SEASONING: COCONUT OIL, SOY SAUCE (WATER, SOYBEAN, SALT, POTASSIUM SORBATE AS PRESERVATIVE), CANE SUGAR, FLAVOR ENHANCER, MONOSODIUM GLUTAMATE, DISODIUM 5' INOSINATE, DISODIUM 5' GUANYLATE), SALT, ARTIFICIAL CHICKEN FLAVOR, SPICES (RED PEPPER, CORN STARCH), DEHYDRATED SOY PROTEIN, ACIDULANT (CITRIC ACID), CARAMEL COLOR, COLORANT (PAPRIKA)."
Pouch Noodles,Lucky Me! Instant Pancit Canton Kalamansi 60g,000-298,14,Instant Noodles,72,"₱1,008.00",https://860036.smushcdn.com/1877928/wp-content/uploads/2020/07/Lucky-me-PC-kalamansi.png?lossy=1&strip=1&webp=1,"Wheat Flour, Vegetable Oil (Palm Oil, Green Tea Extract), Salt, Stabilizer (Guar Gum), Acidity Regulator (Sodium Carbonate, Potassium Carbonate), Emulsifier (Polyphosphate), Seasoning: Coconut Oil, Soy Sauce (Water, Soybean), Salt, Preservative (Potassium Sorbate), Maltodextrin, Flavor Enhancer (Monosodium Glutamate, Disodium 5 Inosinate, Disodium 5 Guanylate), Salt, Cane Sugar, Artificial Chicken Flavor, Dehydrated Vegetables (Carrots, Chives), Acid (Citric Acid), Spices (Onion, Garlic), Color (Caramel Color), Citrus Flavor."
Pouch Noodles,Lucky Me! Instant Pancit Canton Original 60g,000-299,14,Instant Noodles,72,"₱1,008.00",https://www.cebumyxmarket.com/wp-content/uploads/2021/06/LUCKY-ME-PANCIT-CANTON-ORIGINAL-80-GRAMS-12.30-PHP.png,"Wheat Flour (Gluten), Vegetable Oil (Palm Oil, Green Tea Extract), Salt, Stabiliser (Guar Gum), Acidity Regulator (Carbonates (Sodium & Potassium)), Emulsifier (Polyphosphate)."
Pouch Noodles,Lucky Me! Instant Pancit Canton Sweet&Spicy 60g,000-300,14,Instant Noodles,72,"₱1,008.00",https://i0.wp.com/davaogroceriesonline.com/wp-content/uploads/2020/04/Lucky_Me_Pancit_Canton_Sweet_Spicy_60G_1024x1024.png?resize=420%2C420&ssl=1,"Wheat Flour, Vegetable Oil (Palm Oil, Green Tea Extract), Salt, Stabilizer (Guar Gum), Acidity Regulator (Sodium Carbonate, Potassium Carbonate), Emulsifier (Polyphosphate), Seasoning: Soy Sauce (Water, Soybean, Salt, Preservative [Potassium Sorbate]), Coconut Oil, Cane Sugar, Spices (Red Pepper, Garlic), Salt, Flavor Enhancers (Monosodium Glutamate, Disodium 5 Inosinate, Disodium 5 Guanylate), Artificial Chicken Flavor, Dehydrated Vegetables (Red Pepper, Chives), Hydrolyzed Soy Protein, Anticaking Agent (Silicon Dioxide), Color (Paprika Extract)."
Seasoning,Maggi Magic Sarap Seasoning 50g,000-301,20,Condiments,6,₱120.00,https://i2.wp.com/elako.ph/wp-content/uploads/2020/07/Maggi-Magic-Sarap-All-In-One-Seasoning-50g.jpg?fit=1024%2C1024&ssl=1,"Iodised Salt, Monosodium Glutamate, Sugar, Chicken Fat, Flavour Enhancer (Ribonucleotides), Garlic, Onion, Spices, Nature-Identical Flavour (Gluten), Egg Powder, Chicken Powder."
Seasoning,Maggi Magic Sarap Seasoning 8g,000-302,4,Condiments,112,₱448.00,https://danliz.ph/web/image/product.template/6414/image_1024?unique=ad9e216,"Iodised Salt, Monosodium Glutamate, Sugar, Chicken Fat, Flavour Enhancer (Ribonucleotides), Garlic, Onion, Spices, Nature-Identical Flavour (Gluten), Egg Powder, Chicken Powder."
Biscuits,Magic Creams Butter 28g,000-303,7,Snacks,24,₱168.00,https://www.worldofsnacks.com/uploads/1/3/1/2/13127180/s643667121527569464_p237_i2_w1000.jpeg,"Sugar, Hydrogenated Coconut Oil, Hydrogenated Palm Oil, Glucose, Whey (Milk), Flavouring (0.1%), Salt, Emulsifier (Soy Lecithin), Colour (E102), Vitamin A Palmitate, Anti-oxidants (E320, E321, E310)"
Biscuits,Magic Creams Choco 28g,000-304,7,Snacks,12,₱84.00,https://lh3.googleusercontent.com/proxy/jcq03kpYhs-GG_w_PcAri-68WXhy-shhOEJKhEGdKdQRGyCwNQaJpBQ-u1Ty_dUyleua7fn0zphSlQmuozzAj1VQTO8nb34_hwSXQowGXvCGJelmeNkuRARaHeql_wZmb-v0nITuaJc,"Cracker: Wheat Flour (Contains Gluten), Hydrogenated Coconut Oil, Hydrogenated Palm Oil, Salt, Raising Agent (Sodium Bicarbonate), Yeast, Glucose Syrup, Barley Flour (Contains Gluten).
Cream Filling: Sugar, Hydrogenated Palm Oil, Hydrogenated Soybean Oil, Cocoa Powder (2%), Dextrose, Whey (Contains Milk), Glucose, Maize (Corn) Starch, Salt, Emulsifier (Soy Lecithin), Flavouring."
Biscuits,Magic Flakes 28g,000-305,6,Snacks,24,₱144.00,https://i.pinimg.com/originals/87/fc/91/87fc91ff018b5c9d83bd2cf4896a30e1.png,"WHEAT FLOUR, REFINED FATS (MAY CONTAIN ANY OF THE FOLLOWING HYDROGENATED COCONUT, PALM OLEIN, PALM KERNEL AND/OR FISH OIL), IODIZED SALT, SODIUM BICARBONATE, MALT BARLEY FLOUR AND YEAST."
Biscuits,Magic Flakes Cheese 28g,000-306,7,Snacks,12,₱84.00,https://boholgrocery.com/wp-content/uploads/2020/09/Magic-Flakes-Cheese-Crackers-28g-x-10packs.png,"Wheat Flour, Refined Fats (May contain any of the following Hydrogenated Coconut, Palm Olein, Palm Kernel and / or Fish Oil), Iodized Salt, Leavening Agent (Sodium Bicarbonate), Malt Barley Flour and Yeast"
Canned Goods,Maling Luncheon Meat Chicken 397g,000-307,102,Food,2,₱204.00,https://fdi.com.ph/wp-content/uploads/2020/08/maling-chicken.jpg,"Pork Meat (72%), Water, Ham Meat (10%), Salt, Mustard Flour, Pototo Starch, Sugar, Stabilisers: E451, E450, Thickener: E407a, Spices, Antioxidant: E316, Preservative: E250."
Sauce,Mama Sita's Barbecue Marinade 80ml,000-308,19,Condiments,28,₱532.00,https://cdn.shopify.com/s/files/1/0562/3096/9503/products/mama-sitas-barbecue-marinade-80ml-seasonings-284_grande.png?v=1634907274,"Cane Sugar, Water, Soy Sauce (Soybeans, Caramel Color, Salt and Water), Salt, Caramel Color, Fresh Garlic, Monosodium Glutamate, Black Pepper, Citric Acid to Enhance Tartness, Disodium Inosinate and Disodium Guanylate and 0.1% Sodium Benzoate as Preservative. Contains soy."
Food Mixes,Mama Sita's Caldereta Mix 50g,000-309,35,Condiments,6,₱210.00,http://www.filipinan-market.com/images/productos/productos-foto1-461.jpg,"Tomato Powder (29%), Cane Sugar, Salt, Rice Flour, Paprika (7.4%), Garlic Powder, Spices (Chilli, Oregano, Basil, Rosemary Powder), Natural Yeast Extract, Citric Acid."
Food Mixes,Mama Sita's Kare Kare Mix 57g,000-310,36,Condiments,6,₱216.00,https://www.shopinoy.com.au/static/uploads/images/mama-sita-kare-kare-mix-57g-wfubbaobgxfx.png?mode=max&upscale=true&width=768,"Peanuts, Rice Flour, Cane Sugar, Salt and Annatto Powder."
Food Mixes,Mama Sita's Menudo/Afritada Mix 30g,000-311,34,Condiments,6,₱204.00,https://i1.wp.com/elako.ph/wp-content/uploads/2020/08/Mama-Sitas-MenudoAfritada-Mix-30g.jpg?fit=1024%2C1024&ssl=1,"Cane Sugar, Tomato Powder (12%), Onion Powder, Cornstarch, Garlic Powder, Natural Yeast Extract, Citric Acid)."
Sauce,Mama Sita's Oyster Sauce Sachet 30g,000-312,6,Condiments,43,₱258.00,https://danliz.ph/web/image/product.template/6458/image_1024?unique=beb222a,"Water, real oysters, modified starch, cane sugar, salt, hydrolyzed corn and soy protein, caramel color, monosodium glutamate (flavor enhancer), 0.1% sodium benzoate added as a preservative"
Food Mixes,Mama Sita's Palabok Mix 57g,000-313,40,Condiments,4,₱160.00,https://kooryr.ph/wp-content/uploads/2021/07/s-l400_3_123b05bc-96dc-49df-927c-18e0f50665fa_2470x.jpg,"Cornstarch, Rice Flour, Salt, Hydrolyzed Corn and Soy Protein, Monosodium Glutamate, Garlic Powder, Cane Sugar, Spices and Disodium Inosinate and Disodium Guanylate."
Sauce,Mang Tomas All-Around Sarsa 100g,000-314,11,Condiments,12,₱132.00,https://nutriasia.com/wp-content/uploads/2017/10/MANG-TOMAS-All-Around-Sarsa-Regular-100g.png,"Water, Cane, Sugar, Bread Crumbs (Wheat Flour, Sugar and Palm Oil), Cane Vinegar, Salt, Hydrolyzed Plant Protein (Soy Protein), Onions, Garlic, Black Pepper and 0.1% Sodium Benzoate Added as a Preservative"
Sauce,Mang Tomas All-Around Sarsa 325g,000-315,34,Condiments,9,₱306.00,https://nutriasia.com/wp-content/uploads/2017/10/MANG-TOMAS-All-Around-Sarsa-Regular-325gc.png,"Water, Cane, Sugar, Bread Crumbs (Wheat Flour, Sugar and Palm Oil), Cane Vinegar, Salt, Hydrolyzed Plant Protein (Soy Protein), Onions, Garlic, Black Pepper and 0.1% Sodium Benzoate Added as a Preservative"
Cigarettes,Marlboro Gold Flip-Top,000-316,122,Cigarettes,20,"₱2,440.00",https://images.freshop.com/00028200004659/9b22528ae741685fc93f65f27cfcfe10_large.png,"Nicotine, Tar, Carbon monoxide, Arsenic, Ammonia, Acetone, Toluene, Methylamine, Pesticides, Polonium – 210, Methanol"
Cigarettes,Marlboro Menthol Black Flip-Top,000-317,122,Cigarettes,10,"₱1,220.00",https://cdn.shopify.com/s/files/1/0280/7126/4308/products/rsz_1marlboro_black__png_600x.png?v=1586877114,"Nicotine, Tar, Carbon monoxide, Arsenic, Ammonia, Acetone, Toluene, Methylamine, Pesticides, Polonium – 210, Methanol"
Cigarettes,Marlboro Menthol Ice Blast,000-318,122,Cigarettes,2,₱244.00,https://cdn.shopify.com/s/files/1/2149/7731/products/MARLBOROICEBLASTMEGA_1024x1024.png?v=1628842756,"Nicotine, Tar, Carbon monoxide, Arsenic, Ammonia, Acetone, Toluene, Methylamine, Pesticides, Polonium – 210, Methanol"
Cigarettes,Marlboro Red Flip-Top,000-319,122,Cigarettes,40,"₱4,880.00",https://www.nicepng.com/png/detail/394-3940606_marlboro-filter-red-flip-top-pack-marlboro-red.png,"Nicotine, Tar, Carbon monoxide, Arsenic, Ammonia, Acetone, Toluene, Methylamine, Pesticides, Polonium – 210, Methanol"
Canned Goods,Master Sardines Green Easy Open 155g,000-320,21,Food,12,₱252.00,https://cdn.shopify.com/s/files/1/0094/9354/5024/products/4806504710119_580x.png?v=1572150190,"MACKEREL, TOMATO SAUCE, WATER, IODIZED SALT, CHILI POWDER Tomato Sauce Which is Made from Tomato Paste and Water, Modified Cornstarch, Iodized Salt (Salt + Potassium Iodate, Sugar, Onion Powder, Garlic Powder"
Canned Goods,Master Sardines Red Easy Open 155g,000-321,21,Food,12,₱252.00,https://www.crempcoop.com/wp-content/uploads/2019/07/MASTER-SADINES-HOT-EASY-OPEN-155G.png,"MACKEREL, TOMATO SAUCE, WATER, IODIZED SALT, CHILI POWDER Tomato Sauce Which is Made from Tomato Paste and Water, Modified Cornstarch, Iodized Salt (Salt + Potassium Iodate, Sugar, Onion Powder, Garlic Powder, Chili."
Candy,Maxx Candy Calamansi,000-322,1,Snacks,50,₱50.00,https://images.freshop.com/8195217/6c0de48d6325bfff534facb374914c42_large.png,"Natural Honey, Menthol Crystals, Sugar, Glucose Syrup, Citric Acid, Eucalyptus Oil."
Candy,Maxx Candy Cherry,000-323,1,Snacks,50,₱50.00,https://boholonlinestore.com/wp-content/uploads/2020/06/httpsshop.smmarkets.phmediawysiwyglostnfound220100348_-_jack_jill_maxx_candy_cherry_50s.png,"Menthol Crystals, Eucalyptus Oil, Sugar, Artificial Flavor, Glucose, Citric Acid (Acidity Regulator), Artificial Colors (Caramoisine, FD&C Blue 1)."
Candy,Maxx Candy Fresh,000-324,1,Snacks,50,₱50.00,https://cdn.shortpixel.ai/spai/q_lossy+ret_img+to_webp/https://salangikopu.com/wp-content/uploads/2020/09/Maxx-Fresh-Menthol-Candy-Front.png,"Menthol Crystals, Sugar, Glucose, Eucalyptus Oil, Citric Acid (Acidity Regulator), Natural Flavor."
Bandage,Mediplast Bantam Strips,000-325,1,,100,₱100.00,https://philusa.com.ph/wp-content/uploads/2020/05/Mediplast-Bantam-Plastic-Strips-12s-featured.png,
Canned Goods,Mega Sardines Hot Easy Open 155g,000-326,21,Food,12,₱252.00,https://cdn.shopify.com/s/files/1/0379/4249/3323/products/TSC-number-1-min_1024x1024.png?v=1585890845,"MACKEREL, TOMATO SAUCE, WATER, IODIZED SALT, CHILI POWDER"
Canned Goods,Mega Sardines Tomato Easy Open 155g,000-327,21,Food,12,₱252.00,https://cf.shopee.ph/file/a1fb0283c063589999e408a94371506f,"SARDINES, WATER, TOMATO PASTE, MODIFIED STARCH, IODIZED SALT, SUGAR, GARLIC POWDER, ONION POWDER AND XANTHAN GUM"
Seasoning,Menu Magic Sinigang Mix,000-328,5,Soup,24,₱120.00,https://www.srssulit.com/wp-content/uploads/products/10587-1.png,"Iodized salt, Food Acid (Citric), Flavor enhancer (Monosodium glutamate), Tamarind, Tomato, Thickener (Starch), Natural flavors, Palm oil, Sugar, Shrimp, Caramel Color, Calamansi Powder, White Pepper."
Cigarettes,Mighty Green Menthol Flip-Top,000-329,92,Cigarettes,25,"₱2,300.00",https://getgrocery.ph/wp-content/uploads/2020/06/mighty-premium-tobacco-20s-1.jpg,"Nicotine, Tar, Carbon monoxide, Arsenic, Ammonia, Acetone, Toluene, Methylamine, Pesticides, Polonium – 210, Methanol"
Cigarettes,Mighty Red Flip-Top,000-330,92,Cigarettes,5,₱460.00,https://gmart.com.ph/wp-content/uploads/2020/10/MIGHTY-KING-SIZE-RED-SFP.png,"Nicotine, Tar, Carbon monoxide, Arsenic, Ammonia, Acetone, Toluene, Methylamine, Pesticides, Polonium – 210, Methanol"
Energy Powdered Drink,Milo Choco Drink 24g,000-331,8,Beverages,60,₱480.00,https://cf.shopee.ph/file/48cbf96f0dfea4068374926d6810c00e,"Milk powder, barley malt extract, sugar, cocoa, sodium phosphate, dicalcium phosphate, soy lecithin, vitamin a palmitate, thiamine hidrochloride, ferrous fumarate, artificial flavour."
Energy Powdered Drink,Milo Choco Drink Activ-Go 220g,000-332,88,Beverages,4,₱352.00,https://gmart.com.ph/wp-content/uploads/2020/05/MILO-ACTIV-GO-CHOCO-MALT-POWDERED-MILK-DRINK-220G.jpg," Sugar, Protomalt Malt Extract (contains barley), Skimmed Milk (cow's milk), Cocoa, Palm Oil, Minerals (Dicalcium Phosphate, Disodium Phosphate, Ferric Pyrophosphate), Maltodextrin, Flavourings"
Energy Powdered Drink,Milo Choco Drink Twin 48g,000-333,14,Beverages,24,₱336.00,https://console.cloudkart.ph/assets/img/products/fe5b1e8eb8c83d24175d7d0e6663ebb3/5448f1e2ab76c93a0e31d9790d3631ad.jpg,"Milk powder, barley malt extract, sugar, cocoa, sodium phosphate, dicalcium phosphate, soy lecithin, vitamin a palmitate, thiamine hidrochloride, ferrous fumarate, artificial flavour."
Feminine Care,Modess Cottony Soft Regular Maxi Non-Wing,000-334,5,Personal Care,120,₱600.00,https://imartgrocersph.com/wp-content/uploads/2020/09/Modess-Regular-Cottony-Soft-Cover-Non-Wing-8_s.png,"Absorbent, Backsheet, Cover, PE film wrapper, Silicone-coated Paper, Adhesives, Superabsorbent polymer, Fragrance."
Feminine Care,Modess Cottony Soft Regular Maxi W/ Wings,000-335,5,Personal Care,120,₱600.00,https://imartgrocersph.com/wp-content/uploads/2020/09/Modess-Regular-Cottony-Soft-Cover-with-Wings-8_s.png,"Absorbent, Backsheet, Cover, PE film wrapper, Silicone-coated Paper, Adhesives, Superabsorbent polymer, Fragrance."
Biscuits,Monde Sumo Mini Cookies & Cream 20g,000-336,5,Snacks,20,₱100.00,https://fishersupermarket.ph/wp-content/uploads/2020/09/MON51.png,"Sugar, Wheat Flour, Vegetable Fat (may contain one or more of the following : coconut, palm, and palm kernel), Cocoa Powder, Corn Starch, Whey Powder, Raising Agent (INS 500(ii), INS 503(ii)), Iodized Salt, Emulsifier (INS 322(I)), Artificial Vanilla Flavour."
Chips,Mr.Chips Cheese 26g,000-337,7,Snacks,6,₱42.00,https://getgrocery.ph/wp-content/uploads/2020/06/mr-chips-26g.png,"Ingredients: corn 62%, vegetable oil, CHEESE powder 5% (whey, Cheddar CHEESE, BUTTER oil, dried BUTTER MILK, flavour, acidity regulator: E339, colours: E102, E110), skimmed MILK, spices, iodized salt, flavour enhancer: E621, E635, hydrolyzed SOY protein, sugar, antioxidants: E319, E321, E320, E310. This product contains genetically modified corn and SOY.This product may contain traces of WHEAT."
Carbonated,Mt.Dew Glass Bottle 300ml,000-338,13,Beverages,12,₱156.00,https://www.crempcoop.com/wp-content/uploads/2019/07/300mL.jpg,"Carbonated Water, Sugar, Concentrated Orange Juice, Citric Acid, Natural Flavor, Sodium Benzoate (Preserves Freshness), Caffeine, Sodium Citrate, Gum Arabic, Erythorbic Acid (Preserves Freshness), Calcium Disodium EDTA (to Protect Flavor), Yellow 5."
Paper & Plastic Household Supplies,My Everyday Fork White Medium 25's,000-339,12,Household Care,25,₱300.00,https://cf.shopee.ph/file/7568c2502f88b90f8a1cc120bec074ab,-
Paper & Plastic Household Supplies,My Everyday Paper Plate 9 Silver 25's,000-340,12,Household Care,6,₱72.00,https://cf.shopee.ph/file/42e5311303da0b615b3dc831be2fac93,-
Paper & Plastic Household Supplies,My Everyday Spoon White Medium 25's,000-341,12,Household Care,6,₱72.00,https://getgrocery.ph/wp-content/uploads/2020/06/My-Everyday-Spoon-White-25s.jpg,-
OTC Medicine,Neozep Forte Caplet,000-342,6,Healthcare,24,₱144.00,https://assets.unilab.com.ph/uploads/Common/Products/Neozep/Neozep-Forte-Product-Shot.jpg,"Phenylephrine HCl 10 mg, Chlorphenamine Maleate 2 mg, Paracetamol 500 mg"
Coffee Mixes,Nescafe Coffee 3-In-1 Brown Twin Pack 55g,000-343,12,Beverages,12,₱144.00,https://imartgrocersph.com/wp-content/uploads/2020/10/Nescafe-Brown-Twin-Pack-55g.jpg,"Coffee creamer [Glucose syrup, Hydrogenated vegetable oil (may contain one or more of the following oils: Coconut, Palm, Palm kernel), Sequestrants (Dipotassium phosphate, Trisodium citrate, Sodium polyphosphate), Caseinate, Emulsifiers (Mono- and Di-glycerides of Fatty Acids, Diacetyltartaric and fatty acid esters of glycerol), Anti-caking agent (Silicon dioxide), Salt], Sugar, Maltodextrin, NESCAFÉ instant coffee, Nature-identical flavors, Stabilizer (Sodium carboxymethyl cellulose), Iodized salt, Sweetener (Ace-sulfame potassium)"
Coffee Mixes,Nescafe Coffee 3-In-1 Creamy Latte Twin Pack 55g,000-344,12,Beverages,12,₱144.00,https://imartgrocersph.com/wp-content/uploads/2020/09/Nescafe-Creamy-Latte-Twin-Pack-55g.png,"Coffee Creamer [Glucose Syrup, Hhydrogenated Vegetable Oil (May contain one or more of the following oils: Coconut, Palm, Palm Kernel), Sequestrants (Dipotassium Phosphate, Trisodium Citrate, Sodium Hexametaphosphate), Caseinate, Emulsifiers (Mono- an diglycerides of fatty acids, Diacetyltartaric and fatty acid esters of glycerol), Anti-caking agent (Silicon dioxide), Salt], Sugar, Maltodextrin, Nescafe Instant Coffee, Natural, Artificial and Natura Identical Flavors, iodized Salt, Stabilizer (Sodium Carboxymethyl cellulose), Caramelized Sugar, Cocoa Powder, Sweetener (Acesulfame Potassium)"
